{"evaluated_at":"2026-10-07T06:38:06.890Z","known_descendants":[],"original_package_index_sha256":"a7f866843ad6a22471993f802241417feda450e9865c3251ff8ea9c0efdeee74","package_eligibility":"eligible","package_ineligibility_reasons":[],"record_type":"package_verification","run_id":"abf41ffd-3008-4b29-81ee-b65d8095188b","schema_version":1,"selected_amendment_head_sha256":null,"selected_chain":[]}
